{
  "schema_version": 1,
  "change_id": "repair-release55-dependency-output-role-overlap",
  "target_kind": "repair",
  "goal": "Close Release #55 dependency output-evidence role overlap without changing semantic oracle or dependency authority.",
  "profile": "product-repair",
  "allowed_paths": [
    "services/agent-service/src/agent_core/lifecycle/goal_planning.py",
    "services/agent-service/tests/runtime/test_release55_dependency_output_role_overlap.py"
  ],
  "forbidden_paths": [
    "skill-system/**",
    "architecture-skill/**",
    "governance/quality-loop-policy.json",
    "governance/evidence/**",
    ".quality/**",
    ".agents/**",
    ".claude/**",
    ".codex/**",
    "AGENTS.md",
    "CLAUDE.md",
    "services/agent-service/src/agent_core/goal_graph/dependency_alignment.py",
    "services/agent-service/src/agent_core/goal_graph/dependency_proof.py",
    "services/agent-service/src/agent_core/lifecycle/dialogue_runtime.py",
    "services/agent-service/tests/context/strong_context_cases/semantic_goal_coverage_suite_v20_4.json"
  ],
  "invariants": [
    "true explicit current-turn result reference remains a semantic dependency",
    "strict nested evidence overlap is provisional only and never dependency authority",
    "equal or wrapping outcome evidence remains structurally rejected as dependency basis",
    "Stage 4.2 obligation evidence and deterministic reducer remain unchanged authority owners",
    "CapabilityGate transaction business tools production defaults and semantic oracle remain unchanged"
  ],
  "required_profiles": [
    "product-contract",
    "product-portable-conformance",
    "product-security",
    "product-quality-quick"
  ],
  "writer_role": "product-implementer",
  "review_roles": [
    "scope-planner",
    "adversarial-reviewer",
    "release-judge"
  ],
  "review_attestations": [],
  "affected_modules": [
    "agent_core.lifecycle.goal_planning"
  ],
  "minimum_quality_mode": "quick",
  "quality_target": "governance/targets/repair-release55-dependency-output-role-overlap.md",
  "baseline_evidence": "governance/repair-cases/repair-release55-dependency-output-role-overlap/evidence/quality-baseline",
  "initial_source_fingerprint": "71a1a599fa8d0511a57f0554a0974bdedb5f0fc55cd80388cca0d7acdedf1668",
  "initial_source_file_count": 1,
  "product_validation": null,
  "decision_record": null,
  "variance_records": [],
  "architecture_policy_delta": null,
  "baseline_policy_id": null,
  "verification": null,
  "repair_governance": "governance/repair-cases/repair-release55-dependency-output-role-overlap",
  "repair_governance_consumed_at": null,
  "created_at": "2026-08-16T03:36:01.622499+00:00",
  "status": "implementing",
  "result": "PENDING",
  "repair_governance_permit_digest": "a6cae9d1b37478755ad68d0ba867dfbea5a9d35f29c99ed20243830043b40470"
}
